{
  "eventId": "a1b2c3d4-e5f6-4a1b-8c2d-3e4f5a6b7c8d",
  "eventType": "user.updated",
  "version": 1,
  "occurredAt": "2026-10-18T10:00:00.000Z",
  "correlationId": "b2c3d4e5-f6a1-4b2c-9d3e-4f5a6b7c8d9e",
  "payload": {
    "userId": "c3d4e5f6-a1b2-4c3d-ae4f-5a6b7c8d9e0f",
    "changedBy": "d4e5f6a1-b2c3-4d4e-bf5a-6b7c8d9e0f1a",
    "changes": {
      "isActive": false,
      "role": "officer",
      "displayName": "Jane Officer"
    },
    "updatedAt": "2026-10-18T10:00:00.000Z"
  }
}
