{
  "eventId": "a1b2c3d4-e5f6-4a1b-8c2d-3e4f5a6b7c8d",
  "eventType": "user.created",
  "version": 1,
  "occurredAt": "2026-10-12T12:00:00.000Z",
  "correlationId": "b2c3d4e5-f6a1-4b2c-9d3e-4f5a6b7c8d9e",
  "payload": {
    "userId": "c3d4e5f6-a1b2-4c3d-ae4f-5a6b7c8d9e0f",
    "email": "citizen.jane@example.com",
    "displayName": "Jane Doe",
    "role": "citizen",
    "createdAt": "2026-10-12T12:00:00.000Z"
  }
}
